,date,title,press,contents,link
485,2022.10.30.,"윤희숙, ‘이태원 참사 靑 이전 탓’ 남영희에 “정치병자, 사람도리 지켜야”...",스카이데일리,[뉴시스] 윤희숙 전 국민의힘 의원이 30일 이태원 참사의 원인이 청와대 이전 때문이라며 윤석열 대통령의 사퇴를 요구했던 남영희 민주연구원 부원장을 향해 “사람 도리는 버리지 말라”고 지적했다. 윤 전 의원은 이날...,http://www.skyedaily.com/news/news_view.html?ID=171928
486,2022.10.30.,“참사는 대통령실 이전 때문” 남영희 SNS 발언 논란,경향신문,남 부원장은 SNS에 “이태원 참사 원인은 청와대 이전 때문에 일어난 인재”라고 주장했다. 그는 “핼러윈 축제에 10만 인파가 몰릴 것이라 예상한 보도가 있었지만 안전요원 배치는 애초 불가능한 상황이었다”며...,https://www.khan.co.kr/politics/assembly/article/202210302146005
487,2022.10.30.,"""이태원 참사 원인은 靑이전 탓"" 민주연구원 부원장 글 올렸다 삭제",매일경제언론사 선정,"남 부원장은 이날 오전 자신의 사회관계망서비스(SNS)에 글을 올려 ""이태원 참사의 원인은 청와대 이전 때문에 생긴 문제""라고 지적했다. 남 부원장은 ""핼러윈 축제에 10만 인파가 몰릴 것이라 예상한 보도가 있었지만 경찰...",http://news.mk.co.kr/newsRead.php?no=963686&year=2022
488,2022.10.05.,"세종시 대통령집무실 4593억원 책정, 연면적 7만6천평 청와대 규모로",스포츠서울,"행복청은 대통령 집무실 이전으로 개방된 청와대와 같은 규모로 제2집무실을 건립하는 것을 전제로 사업비를 산출했다. 대통령 관저와 집무 공간이 있는 청와대 본관, 외빈을 접견하는 영빈관과 상춘재, 직원...",http://www.sportsseoul.com/news/read/1165750?ref=naver
489,2022.11.02.,"‘참사 靑이전 때문’이라던 남영희, 녹취록 올리며 “이게 나라냐”",서울신문언론사 선정,‘이태원 핼러윈 압사 참사’가 윤석열 대통령의 ‘청와대 이전’ 때문에 발생했다고 주장했던 남영희 민주연구원 부원장이 해당 발언에 대한 여권과 언론의 비판에 “광기 어린 정치모리배들과 기레기(기자+쓰레기)...,https://www.seoul.co.kr/news/newsView.php?id=20221102500038&wlog_tag3=naver
490,2022.11.02.,"‘참사 靑이전 때문’이라던 남영희, 녹취록 올리며 “이게 나라냐”",서울신문언론사 선정,‘이태원 핼러윈 압사 참사’가 윤석열 대통령의 ‘청와대 이전’ 때문에 발생했다고 주장했던 남영희 민주연구원 부원장이 해당 발언에 대한 여권과 언론의 비판에 “광기 어린 정치모리배들과 기레기(기자+쓰레기)...,https://www.seoul.co.kr/news/newsView.php?id=20221102500038&wlog_tag3=naver
491,2022.11.15.,"대통령실 이전 후폭풍, ‘경호처장이 군·경 지휘권 행사’ 시행령 추진",민중의소리,김용현 경호처장은 윤석열 대통령의 충암고 1년 선배다.기존 경호구역이 다소 협소한 범위로 한정돼 있던 청와대에서 대통령실을 이전함으로써 경호처가 통제하는 경호구역은 용산 청사 인근과 한남동 관저 인근...,https://vop.co.kr/A00001623174.html
492,2023.04.17.,"‘전세 사기’ 3번째 사망…남영희, 尹에 읍소 “죽음 뛰어드는 이들 붙잡아 ...",디지털타임스언론사 선정,"이태원 참사와 관련해 '사고의 원인이 청와대 이전 때문', '이게 나라냐' 등의 글을 SNS에 올리면서 윤석열 대통령의 퇴진을 주장했던 남영희 민주연구원 부원장은 윤석열 대통령을 향해 ""대통령께 호소한다....",http://www.dt.co.kr/contents.html?article_no=2023041702109958079008&ref=naver
493,2023.04.10.,"'美 도·감청 의혹' 대통령실 ""靑보다 용산이 '보안·안전' 훨씬 더 탄탄""",더팩트언론사 선정,"이 관계자는 또한 도·감청과 관련해 더불어민주당 측이 대통령실로 들어가는 모든 선과 장비를 재확인할 필요가 있다고 주장한 것에 대해선 ""대통령실 청사의 보안 문제는 (청와대에서) 이전해 올 때부터 완벽하게...",http://news.tf.co.kr/read/ptoday/2010773.htm
494,2022.10.20.,'반말·고성' 파행…靑 이전 비용 1조 vs 이재명 사법 리스크 충돌,머니투데이,"[국정감사]]] 국회 정무위원회 국정감사에서 여야가 윤석열정부의 청와대 이전 비용과 이재명 민주당 대표의 사법 리스크 등을 놓고 고성을 주고 받으며 파행했다. 20일 국회 정무위원회는 한국산업은행, 중소기업은행...",http://news.mt.co.kr/mtview.php?no=2022102012293768822
495,2022.10.05.,[단독] 세종 대통령 집무실 ‘청와대 규모’ 신축…4600억 책정,한겨레언론사 선정,"행복청은 사업비를 책정하며 용산 대통령 집무실 이전으로 개방된 청와대와 같은 규모의 시설물을 짓는 것을 전제로 깔았다. 대통령 관저와 집무공간이 위치한 청와대 본관, 외빈을 접견하는 영빈관과 상춘재, 직원...",https://www.hani.co.kr/arti/politics/politics_general/1061438.html
496,2022.10.05.,"김두관 의원 ""대통령 세종 집무실, 청와대 규모로 짓는다..4593억원 투입""",브레이크뉴스,행복청은 사업비를 책정하며 용산 대통령 집무실 이전으로 개방된 청와대와 같은 규모의 시설물을 짓는 것을 전제로 했다. 대통령 관저와 집무공간이 위치한...,http://www.breaknews.com/928525
497,2022.07.13.,"안규백 의원 ""청와대 이전에 국방시설 연쇄 이동…미래 안보분야 연구에 공백...",뉴스웍스,"안규백 더불어민주당 의원이 ""청와대 이전에 따른 국방 시설의 연쇄 이동이 결국 미래 핵심 안보분야의 연구 공백을 초래했다""고 주장했다. 안 의원은 13일 자신의 페이스북을 통해 ""이것은 빙산의 일각에 불과할 것이다....",http://www.newsworks.co.kr/news/articleView.html?idxno=603073
498,2022.10.31.,"김정화, ‘이태원 참사 靑이전 탓’ 남영희에 “이때다 싶어 선동”",헤럴드경제,"앞서 남 부원장은 이번 일을 놓고 ""청와대 이전 때문에 일어난 인재""라고 주장했다. 김 전 위원은 지난 30일 페이스북 글을 통해 ""거짓, 선동, 남탓. 국민적 비극 앞에 이러기도 쉽지 않다""며 ""설마, 이때다 싶었는가""라고...",http://news.heraldcorp.com/view.php?ud=20221031000056
499,2022.10.31.,"민주연구원 남영희 “이태원 참사, 靑 이전이 원인”… 글 삭제 후에도 비난 ...",세계일보언론사 선정,연합뉴스 더불어민주당 싱크탱크인 민주연구원 남영희 부원장이 30일 153명의 사망자를 낸 ‘이태원 핼러윈 참사’가 ‘윤석열 정부의 청와대 이전 때문에 발생한 인재’라고 주장해 파문이 일었다. 이날 연합뉴스에...,http://www.segye.com/content/html/2022/10/30/20221030512139.html?OutUrl=naver
500,2022.10.05.,"정부, 대통령 세종 집무실 청와대 규모로 짓는다...4593억 책정",열린뉴스통신,"행복청은 사업비를 책정하며 용산 대통령 집무실 이전으로 개방된 청와대와 같은 규모의 시설물을 짓는 것을 전제로 깔았다. 대통령 관저와 집무공간이 위치한 청와대 본관과 외빈을 접견하는 영빈관과 상춘재, 직원...",https://www.onews.tv/news/articleView.html?idxno=140172
501,2022.07.13.,"안규백 의원 ""청와대 이전에 국방시설 연쇄 이동…미래 안보분야 연구에 공백...",뉴스웍스,"안규백 더불어민주당 의원이 ""청와대 이전에 따른 국방 시설의 연쇄 이동이 결국 미래 핵심 안보분야의 연구 공백을 초래했다""고 주장했다. 안 의원은 13일 자신의 페이스북을 통해 ""이것은 빙산의 일각에 불과할 것이다....",http://www.newsworks.co.kr/news/articleView.html?idxno=603073
502,2022.10.31.,"김정화, ‘이태원 참사 靑이전 탓’ 남영희에 “이때다 싶어 선동”",헤럴드경제,"앞서 남 부원장은 이번 일을 놓고 ""청와대 이전 때문에 일어난 인재""라고 주장했다. 김 전 위원은 지난 30일 페이스북 글을 통해 ""거짓, 선동, 남탓. 국민적 비극 앞에 이러기도 쉽지 않다""며 ""설마, 이때다 싶었는가""라고...",http://news.heraldcorp.com/view.php?ud=20221031000056
503,2022.10.31.,"민주연구원 남영희 “이태원 참사, 靑 이전이 원인”… 글 삭제 후에도 비난 ...",세계일보언론사 선정,연합뉴스 더불어민주당 싱크탱크인 민주연구원 남영희 부원장이 30일 153명의 사망자를 낸 ‘이태원 핼러윈 참사’가 ‘윤석열 정부의 청와대 이전 때문에 발생한 인재’라고 주장해 파문이 일었다. 이날 연합뉴스에...,http://www.segye.com/content/html/2022/10/30/20221030512139.html?OutUrl=naver
504,2022.10.31.,野일각 “靑이전이 빚은 참사” 글 올렸다 삭제,조선일보,남영희 민주연구원 부원장은 이날 페이스북에 “백번 양보해도 이 모든 원인은 용산 국방부 대통령실로 집중된 경호 인력 탓”이라며 “청와대 이전 때문에 일어난 인재”라고 했다. 그는 “(이번 사고는) 졸속으로...,https://www.chosun.com/politics/politics_general/2022/10/31/TPYCHUM67RC6DD6S2YEDQPOVGY/?utm_source=naver&utm_medium=referral&utm_campaign=naver-news
505,2022.11.07.,"대통령실 이전 예산이 왜 외교부에?...여야, 외교부 내년도 예산안 보류",매일경제언론사 선정,더불어민주당은 리셉션 공간의 필요성은 인정하면서도 “청와대 용산 이전에 따른 파생 비용”이라고 지적했다. 대통령실 이전으로 드는 예산인 만큼 외교부 예산으로 편성해서는 안 된다는 얘기다. 반면 국민의힘은...,https://www.mk.co.kr/article/10519652
506,2022.11.01.,"한병도, “대통령 집무실 이전비 눈덩이”",새전북신문,"한병도 의원실이 서울시와 서울시 소방재난본부로부터 제출받은 자료를 보면, 서울시 소방재난본부는 청와대 소방대 이전을 위해 예산 11억4,934만 원을 올해 2분기 예비비로 편성했다. 민주당은 또한 대통령실이...",http://sjbnews.com/news/news.php?number=760918
507,2022.10.30.,"“이태원 참사, 靑이전 때문” 야당 인사에 與 “정치병자” 맹폭 [이태원 핼...",세계일보언론사 선정,다만 한 야당 인사가 이번 참사를 두고 “청와대 이전 때문에 일어난 인재(人災)”라고 한 것을 겨냥해선 “정치병자”라는 등 맹비판을 쏟아내기도 했다. 국민의힘 정진석 비상대책위원장(가운데 왼쪽)과 비대위원들이...,http://www.segye.com/content/html/2022/10/30/20221030512209.html?OutUrl=naver
508,2022.10.30.,"민주연구원 부원장 ""靑 이전 때문"" 올렸다 삭제",TV조선언론사 선정,"남영희 민주연구원 부원장이 이태원 참사가 청와대 이전 때문이라는 글을 올렸다가 삭제했다. 남 부원장은 페이스북에 ""모든 원인은 용산 국방부 대통령실로 집중된 경호 인력 탓""이라며 이태원 참사는 ""졸속으로 결정해서...",http://news.tvchosun.com/site/data/html_dir/2022/10/30/2022103090108.html
509,2022.10.30.,"민주연구원 부원장 ""이태원 참사는 尹·靑 이전 탓""",이데일리,"남 부원장은 30일 자신의 SNS를 통해 “이태원 참사의 원인은 청와대 이전 때문에 일어난 인재”라며 윤석열 대통령과 오세훈 서울시장, 이상민 행정안전부 장관의 사퇴를 요구했다. 다만 해당 글은 현재 삭제된 상태다. 남...",http://www.edaily.co.kr/news/newspath.asp?newsid=01617046632498168
510,2022.10.30.,"野민주연구원 부원장 ""이태원 참사 원인은 靑이전"" 올렸다 삭제",중앙일보언론사 선정,남영희 민주연구원 부원장은 30일 ‘이태원 압사 참사’ 관련 “원인은 청와대 이전 때문에 일어난 인재”라고 주장했다. 민주연구원은 더불어민주당의 싱크탱크다. 남 부원장은 이날 자신의 페이스북에 “핼러윈...,https://www.joongang.co.kr/article/25113326
511,2022.10.30.,"여야, 한목소리로 애도…野남영희 ""참사원인은 靑 이전"" 논란",TV조선,"이런 와중에 남영희 민주연구원 부원장이 ""이태원 참사의 원인은 청와대 이전 때문""이라는 글을 SNS에 올렸다가, 국민적 참사를 정치 공세에 이용한다는 비판에 직면했습니다. 김태훈 기자입니다. 여야 지도부 모두 긴급...",http://news.tvchosun.com/site/data/html_dir/2022/10/30/2022103090118.html
512,2022.10.23.,"대통령실, '청와대' 들어낸 새 CI 공개...11월부터 사용",굿모닝경제,"이전 청와대 로고의 중심에 있던 기와집 모양을 들어내고, 용산 대통령실 청사 건물을 바탕으로 봉황 두 마리와 무궁화를 배치했다. 이재명 부대변인은 이날 브리핑에서 ""대통령실 새로운 CI는 대한민국의 자유·평화...",http://www.goodkyung.com/news/articleView.html?idxno=190501
513,2022.10.30.,"남영희 ""이태원 참사는 靑 이전 탓"", 野 'SNS 경계령' 무용지물",프레시안,"참사 와중에 부적절한 정쟁화, 민주당 지도부 ""부적절"" 더불어민주당 남영희 민주연구원 부원장이 이태원 핼러윈 참사를 ""청와대 이전 때문에 일어난 인재""라고 주장해 빈축을 사고 있다. 남 부원장은 30일 오전 페이스북을...",https://www.pressian.com/pages/articles/2022103012110536485?utm_source=naver&utm_medium=search
514,2022.10.30.,"이태원 사고 靑 이전 탓?…與 ""애도기간에 정쟁 멈추자""",머니투데이,"남영희 민주연구원 부위원장이 이번 사고의 원인을 청와대 이전 때문이라고 주장한 것에 대해서는 ""논평할 가치가 없다""고 일축했다. 양금희 국민의힘 수석대변인은 이날 이태원 참사 관련 논평 후 기자들과 만나 앞서...",http://news.mt.co.kr/mtview.php?no=2022103010585320966
515,2022.09.30.,인수위 전화 이틀 만에 “청와대 개방 효과 2000억”,베타뉴스,해당 자료는 인수위가 주장한 '청와대 이전 비용 500억보다 청와대 개방의 경제효과가 크다'라는 근거로 직·간접적으로 언급된 바 있다. 국회 문화체육관광위원회 소속 더불어민주당 전재수 의원(부산 북구·강서구갑)이...,http://www.betanews.net:8080/article/1364034.html
516,2023.04.11.,"韓·美 ""도·감청 의혹 문건, 상당수 위조""",한국경제,"대통령실은 대통령 집무실을 청와대에서 용산으로 이전해 도·감청 위험에 더욱 노출됐다는 야당의 공세를 다시 한번 반박했다. 대통령 집무실과 비서실, 국가안보실 등이 흩어져 있던 청와대 시절과 달리 현재는 통합...",https://www.hankyung.com/politics/article/2023041107551
517,2023.04.11.,"대통령실 ""대통령·참모 집무실 같은 '보안 수준'…靑 대통령 중심""",뉴스1,"또한 이 관계자는 ""이번에 여러 감청 논란이 있는 이스라엘, 영국, 프랑스 등의 나라에서 대통령실을 이전했나, 총리실을 이전했나, 다른 국가기관을 이전했나""라며 ""청와대에서 용산으로 이전해 보안 문제가 생겼다는...",https://www.news1.kr/articles/5011714
518,2022.10.06.,"[정동칼럼] 청와대의 곡절, 대통령제의 곡절",경향신문,"15년 넘게 출퇴근길에 청와대 앞길을 지나다녔기에 대통령 관저 이전과 청와대 개방에 대해 나름의 소회가 있었는데, 이제야 청와대를 관람했다. 청와대 주변길과 근처 동네는 산 아래 터를 잡은, 오래된 서울 특유의...",https://www.khan.co.kr/opinion/column/article/202210060300085
519,2022.10.05.,대통령 세종집무실에 4천593억원 책정…청와대 규모로 짓는다(종합),연합뉴스언론사 선정,"행복청은 대통령 집무실 이전으로 개방된 청와대와 같은 규모로 제2집무실을 건립하는 것을 전제로 사업비를 산출했다. 대통령 관저와 집무 공간이 있는 청와대 본관, 외빈을 접견하는 영빈관과 상춘재, 직원...",https://www.yna.co.kr/view/AKR20221005132851003?input=1195m
520,2022.10.05.,대통령 세종집무실에 4천593억원 책정…청와대 규모로 짓는다(종합),연합뉴스언론사 선정,"행복청은 대통령 집무실 이전으로 개방된 청와대와 같은 규모로 제2집무실을 건립하는 것을 전제로 사업비를 산출했다. 대통령 관저와 집무 공간이 있는 청와대 본관, 외빈을 접견하는 영빈관과 상춘재, 직원...",https://www.yna.co.kr/view/AKR20221005132851003?input=1195m
521,2022.10.05.,“청와대급으로 짓겠다” 세종 대통령 제2집무실 사업비로 4593억원 쓴다는 윤...,경향신문언론사 선정,"행복청은 사업비 책정 근거로 “용산 대통령실 집무실 이전으로 개방된 청와대와 같은 규모의 시설물을 짓기 위해서”라고 전제했다. 대통령 관저와 집무공간이 위치한 청와대 본관, 외빈을 접견하는 영빈관과 상춘재...",https://www.khan.co.kr/politics/assembly/article/202210051603011
522,2022.10.12.,대통령실·관저 이전 졸속 추진에 감사청구한 시민들 “불법 의혹 부지기수”,민중의소리,"청와대 대통령실경호실 이전과 리모델링에 353억원, 국방부를 인근 합참 청사로 이전하는데 118억원, 대통령 관저로 사용할 한남동 공관 리모델링과 경호시설에 25억원 등이 소요될 것이라고 설명했다.윤 대통령이 제시한...",https://vop.co.kr/A00001621179.html
523,2022.10.20.,[2022 국감] '국회 패싱'…산은 졸속 부산이전 논란(종합),아시아타임즈,"이에 윤한홍 의원이 ""청와대 이전에 1조원이 넘게 들어간다는 부분은 팩트가 아니고, 부울경 메가시티 파기도 팩트 아니다. 청와대 이전은 496억 + 25억원이다. 그리고 부울경 메가시티는 경남도지사가 한 얘기""라며 ""이판은...",https://www.asiatime.co.kr/article/20221020500312
524,13시간 전,"尹 대통령 '日 무릎' 발언에...박수현 ""애드리브 가능성 높다""",아주경제,"com 박수현 전 청와대 국민소통수석 [사진=연합뉴스] 박수현 전 청와대 소통수석이 26일 윤석열 대통령의 '일본... 그는 ""어느 정부나 문재인 정부나 그 이전 정부들이나 우리나라 외교부가 가지고 있는 외교의...",https://www.ajunews.com/view/20230426083602182
525,2022.10.30.,이 와중에…靑이전 탓한 민주硏 부원장,매일경제,"졸속적으로 결정해서 강행한 청와대 이전이 야기한 대참사다. 여전히 서초동 아크로비스타에서 출퇴근하는 희귀한 대통령 윤석열 때문""이라고 목소리를 높였다. 그러면서 ""이상민 행정안전부 장관, 오세훈 서울시장은...",http://news.mk.co.kr/newsRead.php?no=964431&year=2022
526,1일 전,미세먼지 차단도 '부익부 빈익빈?'[김용훈의 먹고사니즘],헤럴드경제,실제 코로나19 이전인 지난 2018년 한국보건사회연구원(보사연)이 우리나라 성인 3839명에게 가장 불안해하는... 오죽하면 2019년 청와대 국민청원 게시판에는 ‘진도에 인공태풍 기지를 건설해서 중국 미세먼지를...,http://news.heraldcorp.com/view.php?ud=20230425000701
527,2022.09.30.,"전재수 의원 ""청와대 개방 효과 2000억? 이틀 만에 작성된 비공식보고서""",CNB뉴스,"전 의원이 연구원으로부터 제출받은 국정감사 요구자료에 따르면, 인수위 청와대 이전 태스크포스(TF)는 연구원에 직접 전화를 걸어 청와대 개방과 관련한 경제적 효과 등 유사 연구자료가 있는지, 비슷한 성격의...",https://www.cnbnews.com/news/article.html?no=566995
528,2022.10.11.,"[2022 국정감사-문광위] 전재수 의원, ""청와대 활용에 술술 새는 국민 혈세""",일요서울,"청와대 이전 비용이 기하급수적으로 늘고 있는 가운데, 남겨진 청와대를 활용하는 과정에서도 국민 혈세가 낭비되고 있는 것으로 나타났다. 청와대 개방이 절차와 체계 없이 진행되면서 사업 진행과 예산집행에도 구멍이...",http://www.ilyoseoul.co.kr/news/articleView.html?idxno=467649
529,2022.10.11.,"""무법천지"" vs ""광우병처럼 국민 호도"" 청와대 개방예산 공방",JTBC,"청와대가 개방되고 처음 열린 문화재청 국정 감사, 더불어민주당은 예산 곳곳에 청와대 이전비용이 숨어있다고 지적했습니다. [임오경/더불어민주당 의원 : 부처별로 숨어 있는 예산을 민주당에서 숨바꼭질하듯이 지금...",https://news.jtbc.co.kr/article/article.aspx?news_id=NB12082982
530,2022.10.05.,청와대 수준 '세종시 대통령 제2집무실'...조성 사업비 4593억 책정,뉴스티앤티,"행복청은 사업비를 책정하며 용산 대통령 집무실 이전으로 개방된 청와대와 같은 규모의 시설물을 짓는 것을 전제로 깔았다. 대통령 관저와 집무공간이 위치한 청와대 본관, 외빈을 접견하는 영빈관과 상춘재, 직원...",http://www.newstnt.com/news/articleView.html?idxno=229580
531,2022.10.12.,대통령실·관저 이전 졸속 추진에 감사청구한 시민들 “불법 의혹 부지기수”,민중의소리,"청와대 대통령실경호실 이전과 리모델링에 353억원, 국방부를 인근 합참 청사로 이전하는데 118억원, 대통령 관저로 사용할 한남동 공관 리모델링과 경호시설에 25억원 등이 소요될 것이라고 설명했다.윤 대통령이 제시한...",https://vop.co.kr/A00001621179.html
532,2022.10.20.,[2022 국감] '국회 패싱'…산은 졸속 부산이전 논란(종합),아시아타임즈,"이에 윤한홍 의원이 ""청와대 이전에 1조원이 넘게 들어간다는 부분은 팩트가 아니고, 부울경 메가시티 파기도 팩트 아니다. 청와대 이전은 496억 + 25억원이다. 그리고 부울경 메가시티는 경남도지사가 한 얘기""라며 ""이판은...",https://www.asiatime.co.kr/article/20221020500312
533,13시간 전,"尹 대통령 '日 무릎' 발언에...박수현 ""애드리브 가능성 높다""",아주경제,"com 박수현 전 청와대 국민소통수석 [사진=연합뉴스] 박수현 전 청와대 소통수석이 26일 윤석열 대통령의 '일본... 그는 ""어느 정부나 문재인 정부나 그 이전 정부들이나 우리나라 외교부가 가지고 있는 외교의...",https://www.ajunews.com/view/20230426083602182
534,2022.10.30.,이 와중에…靑이전 탓한 민주硏 부원장,매일경제,"졸속적으로 결정해서 강행한 청와대 이전이 야기한 대참사다. 여전히 서초동 아크로비스타에서 출퇴근하는 희귀한 대통령 윤석열 때문""이라고 목소리를 높였다. 그러면서 ""이상민 행정안전부 장관, 오세훈 서울시장은...",http://news.mk.co.kr/newsRead.php?no=964431&year=2022
535,1일 전,미세먼지 차단도 '부익부 빈익빈?'[김용훈의 먹고사니즘],헤럴드경제,실제 코로나19 이전인 지난 2018년 한국보건사회연구원(보사연)이 우리나라 성인 3839명에게 가장 불안해하는... 오죽하면 2019년 청와대 국민청원 게시판에는 ‘진도에 인공태풍 기지를 건설해서 중국 미세먼지를...,http://news.heraldcorp.com/view.php?ud=20230425000701
536,2022.09.30.,"전재수 의원 ""청와대 개방 효과 2000억? 이틀 만에 작성된 비공식보고서""",CNB뉴스,"전 의원이 연구원으로부터 제출받은 국정감사 요구자료에 따르면, 인수위 청와대 이전 태스크포스(TF)는 연구원에 직접 전화를 걸어 청와대 개방과 관련한 경제적 효과 등 유사 연구자료가 있는지, 비슷한 성격의...",https://www.cnbnews.com/news/article.html?no=566995
537,2022.10.11.,"[2022 국정감사-문광위] 전재수 의원, ""청와대 활용에 술술 새는 국민 혈세""",일요서울,"청와대 이전 비용이 기하급수적으로 늘고 있는 가운데, 남겨진 청와대를 활용하는 과정에서도 국민 혈세가 낭비되고 있는 것으로 나타났다. 청와대 개방이 절차와 체계 없이 진행되면서 사업 진행과 예산집행에도 구멍이...",http://www.ilyoseoul.co.kr/news/articleView.html?idxno=467649
538,2022.10.11.,"""무법천지"" vs ""광우병처럼 국민 호도"" 청와대 개방예산 공방",JTBC,"청와대가 개방되고 처음 열린 문화재청 국정 감사, 더불어민주당은 예산 곳곳에 청와대 이전비용이 숨어있다고 지적했습니다. [임오경/더불어민주당 의원 : 부처별로 숨어 있는 예산을 민주당에서 숨바꼭질하듯이 지금...",https://news.jtbc.co.kr/article/article.aspx?news_id=NB12082982
539,2022.10.11.,"김승수 의원, “청와대 관광객 200만명 돌파, 인근가게 매출 5배 상승”",서울경제TV,"한국관광공사가 문화체육관광부로부터 위탁·운영하고 있는 청와대 인근 사랑채 건물의 1층 카페 매출액은 청와대 개방 직후 약 5배 이상 급증했다.해당 카페 매출액을 살펴보면, 청와대가 개방되기 이전인 2021년...",http://www.sentv.co.kr/news/view/632985
