,date,title,press,contents,link
756,2022.08.24.,‘청와대 화보’ 비판 탁현민 “한혜진·보그는 잘못 없어”,서울신문언론사 선정,"어쨌든 청와대 이전의 당위를 계속해서 설명하는 수밖에 없지 않느냐”고 반문했다. 이어 “그런데 설명이 잘 안 되니 결국은 ‘많은 사람들이 청와대를 오가고 있다, 국민들이 좋아한다, 그리고 더 많은 사람들을...",https://www.seoul.co.kr/news/newsView.php?id=20220824500025&wlog_tag3=naver
757,2022.08.24.,"""네가 왜 거기서 나와""...한혜진 청와대 보그 화보 찍어",공감신문,"같은 날 탁현민 전 청와대 의전비서관은 자신의 페이스북을 통해 ""윤석열 대통령은 단순히 집무실을 이전한 것이 아니며 청와대라는 대한민국 역사의 중요한 상징적 공간을 국민적 동의 없이 폐쇄한 것이다""라고...",https://www.gokorea.kr/news/articleView.html?idxno=729485
758,2022.05.10.,청와대 개방 앞서 이전한 경비단,뉴스1,"청와대 내부 경비를 담당해왔던 101경비단과 청와대 외과을 경비하던 202경비단은 국방부로 이전, 이날부터 윤석열 대통령이 근무하는 국방부 청사를 경비한다. 2022.5.10/뉴스1",https://www.news1.kr/photos/view/?5361627
759,2022.04.17.,청와대 이전시 관광수입 1조8000억?... 타당성 논란,조세일보언론사 선정,"이에 대해 우석진 명지대 경제학과 교수는 지난달 29일 MBC라디오 '김종배의 시선집중'에 출연해 ""청와대 이전으로 예상되는 연간 편익이 2000억 원 정도 되니까 5년 재임 기간 최소 1조원의 수익은 나오지 않겠냐는 생각인...",http://www.joseilbo.com/news/news_read.php?uid=452030&class=32&grp=
760,2022.04.17.,청와대 이전시 관광수입 1조8000억?... 타당성 논란,조세일보언론사 선정,"이에 대해 우석진 명지대 경제학과 교수는 지난달 29일 MBC라디오 '김종배의 시선집중'에 출연해 ""청와대 이전으로 예상되는 연간 편익이 2000억 원 정도 되니까 5년 재임 기간 최소 1조원의 수익은 나오지 않겠냐는 생각인...",http://www.joseilbo.com/news/news_read.php?uid=452030&class=32&grp=
761,2일 전,"경찰, '김건희 명예훼손 혐의' 우상호·장경태 의원 검찰 송치",뉴스핌,"[서울=뉴스핌] 윤석열 대통령 부인 김건희 여사가 4일 청와대 상춘재에서 열린 국가무형문화재 전통공연... 경찰은 대통령 관저 결정에 개입했다는 의혹을 받는 역술인 '천공'과 관련해서는 ""변호인을 통해 관저 이전에...",http://www.newspim.com/news/view/20230424000528
762,2022.08.23.,"[여랑야랑]한동훈, 법사위서 승리? / 청와대 ‘품격’ 논쟁",채널A언론사 선정,"대통령실의 용산 이전으로 청와대가 개방된 지 100일이 지났죠. 탁현민 전 청와대 의전비서관은 ""청와대 개방은 실패한 결정""이라며 ""국가의 품격이 떨어졌다""고 혹평을 했습니다. Q. 품격, 뭐가 문제라는 건가요? 지금...",http://www.ichannela.com/news/main/news_detailPage.do?publishId=000000310743
763,2022.04.28.,"고민정, `검수완박 국민투표` 언급한 尹측에 ""청와대 이전부터 국민투표""",디지털타임스언론사 선정,"고민정 더불어민주당 의원이 28일 윤석열 대통령 당선인의 비서실장인 장제원 국민의힘 의원이 '검수완박(검찰 수사권 완전 박탈) 국민투표'를 언급한 것에 대해 ""청와대 이전부터 국민투표에 붙여줄 것을 요구한다""고...",http://www.dt.co.kr/contents.html?article_no=2022042802109958044003&ref=naver
764,2022.08.23.,"탁현민 ""윤 대통령 청와대 폐쇄는 실패한 결정, 국가 품격 떨어트려""",뉴스토마토,"22일 탁현민은 페이스북에 ""윤 대통령은 단순히 집무실을 이전한 것이 아니라 청와대라는 대한민국 역사의 중요한 상징적 공간을 과반의 국민적 동의 없이 폐쇄한 것""이라며 이같이 말했다. 이어 “폐쇄하는 것에 그친 게...",http://www.newstomato.com/ReadNews.aspx?no=1142636&inflow=N
765,2022.09.01.,5백억만 쓴다더니‥갈수록 늘어나는 대통령실 이전비,MBC언론사 선정,"496억의 예비비를 신청할 계획입니다."" 윤 대통령의 핵심 측근이자 당시 청와대이전 TF팀장은 한 발 더 나가 5백억 원을 넘지 않을 거라고 호언장담했습니다. [윤한홍/당시 청와대이전 TF 팀장(지난 3월 21일, CBS 라디오...",https://imnews.imbc.com/replay/2022/nwdesk/article/6403917_35744.html
766,2022.04.27.,"[단독] 청와대이전TF ""용산 집무실 '위기관리센터' 오는 금요일 완공""",JTBC언론사 선정,[윤한홍/청와대이전TF 팀장 : 청와대는 지금 큰 컴퓨터 하나에 (통신망이 다) 연결돼 있어요. 우리는 한 15개씩 (통신망) 나눠 가지고 중소형 컴퓨터 5대에 연결한다 이 말이에요. 기능하는 데 아무 문제가 없어요.] 또 '안보...,https://news.jtbc.joins.com/article/article.aspx?news_id=NB12057015
767,2022.09.01.,"민주 ""대통령실 이전에 307억 더 들어""",디지털타임스,"정부 측은 집무실을 청와대에서 용산으로 이전하는 데 기존에 알려진 비용에 더해 총 300억여 원이 추가로 투입된 것과 관련해 ""각 부처별로 자체 판단한 데 따른 부대비용""이라고 밝혔다. 대통령실 고위 관계자는 이날...",http://www.dt.co.kr/contents.html?article_no=2022090202100458027001&ref=naver
768,2022.09.01.,"496억이라던 대통령실 용산 이전 비용, 최소 300억 추가 투입",국제신문언론사 선정,"대통령실이 대통령 집무실을 청와대에서 용산으로 이전하는 데 애초 496억 원이이 든다고 추산했지만, 최소 300억 원 넘는 예산이 추가로 투입된 것으로 알려졌다. 이 비용은 정부 부처의 다른 예산을 전용해 마련됐다....",http://www.kookje.co.kr/news2011/asp/newsbody.asp?code=0100&key=20220901.99005000183
769,2022.08.26.,[국정운영 지지율] 윤석열 '긍정' 27% '부정' 64%…집무실 용산 이전 '좋지 않...,톱스타뉴스,"◆ 대통령 집무실 용산 이전 윤석열 대통령 집무실을 청와대에서 용산으로 이전한 것과 관련해 '좋게 본다' 31%, '좋지 않게 본다'가 56%로 나타났다. 집무실 이전을 좋게 보는 이유로는 '청와대 개방/국민에게 돌려줌...",http://www.topstarnews.net/news/articleView.html?idxno=14726184
770,2022.08.26.,[국정운영 지지율] 윤석열 '긍정' 27% '부정' 64%…집무실 용산 이전 '좋지 않...,톱스타뉴스,"◆ 대통령 집무실 용산 이전 윤석열 대통령 집무실을 청와대에서 용산으로 이전한 것과 관련해 '좋게 본다' 31%, '좋지 않게 본다'가 56%로 나타났다. 집무실 이전을 좋게 보는 이유로는 '청와대 개방/국민에게 돌려줌...",http://www.topstarnews.net/news/articleView.html?idxno=14726184
771,2022.08.31.,“대통령실 이전 관련 예산 300억 더 투입”…이전비용 논란,국민일보언론사 선정,민주당은 이에 따라 대통령실이 당초 밝혔던 청와대 집무실 이전 비용 496억원에서 추가로 투입된 예산이 나타난 만큼 내역과 경위를 살펴볼 계획이다. 앞서 지난 17일에는 대통령실 이전에 따른 안보·재난 공백비용...,https://news.kmib.co.kr/article/view.asp?arcid=0017427361&code=61111211&cp=nv
772,2022.04.14.,[기고문] '청와대이전TF'는 법의 사각지대?,뉴스타파언론사 선정,"'청와대이전TF'라는 곳이 있다. 윤석열 대통령 당선자가 당선 직후에 본인 직속으로 만든 기구라고 한다. 그런데, 이 기구는 대통령직인수위원회 소속이 아니다. 대통령직인수위원회 홈페이지에 있는 인수위원회...",https://newstapa.org/article/2UF6J
773,2022.04.14.,"청와대 이전TF, 온라인소통관 '청와대, 국민 품으로' 개설",더팩트,"청와대 개방 이후 활용방안 국민 아이디어 제안 코너 운영 제20대 대통령직인수위원회 청와대이전 태스크포스(TF)는 오는 5월 10일 청와대 국민 개방을 앞두고 청와대 개방 공식 홈페이지 '청와대, 국민 품으로...",http://news.tf.co.kr/read/ptoday/1931419.htm
774,2022.04.25.,"청와대이전TF, 내달 10일 취임식 이후 청와대 완전 개방",이투데이,이투데이=한영대 기자 | 개방 초기 관람 신청서비스 제도 운영…입장료 무료 북악산 등산로는 인원 제한 없이 내달 10일 전면 개방 대통령직인수위원회 청와대 이전 태스크포스(TF)는 내달 10일 대통령 취임식이 끝나는...,https://www.etoday.co.kr/news/view/2127401
775,2022.06.27.,중립성 훼손 우려에도 ‘경찰국 신설’ 강행···이상민 “이전 정부선 청와...,경향신문,이 장관은 “역대 정부에서 청와대 민정수석 또는 치안비서관이 행정안전부를 건너뛰고 비공식적으로 경찰을 직접 통제했던 것과 달리 현 정부는 헌법과 법률에 따라 행정안전부장관을 통해 경찰을 지휘하도록 하고...,https://www.khan.co.kr/national/national-general/article/202206271623001
776,2022.08.03.,"[세계타워] 청와대 논란, 대통령 지지율 폭락 한몫",세계일보,그럼에도 이명박·문재인 등 ‘청와대 집무실 이전’을 대선공약으로 내세웠던 전 대통령들은 막상 취임하면 경호 문제 등 불가피한 사정을 대며 약속을 지키지 못했다. 선배들과 달리 윤 대통령은 취임하기도 전에 청와대...,http://www.segye.com/content/html/2022/08/03/20220803519109.html?OutUrl=naver
777,2022.07.25.,"[영상] 한덕수의 동문서답에 대노한 김병주..""청와대 이전비용 수조원 눈덩이...",팩트TV,2022년 7월 25일 국회에서국회 본회의 - 대정부질문 1일차(정치·외교·통일·안보 분야)가 진행되었다. 진실언론 팩트TV가 독자 여러분의 소중한 제보를 받습니다.뉴스 가치나 화제성이 있다고 판단되는...,http://facttv.kr/facttvnews/detail.php?number=34820&thread=14r08
778,2022.04.30.,"권성동 ""청와대 이전이 백년대계면, 검수완박은 천년대계""",머니투데이,"권 원내대표는 이날 오후 검수완박(검찰 수사권 완전 박탈) 법안 처리를 위해 소집된 국회 본회의에 앞서 열린 의원총회에서 ""청와대 이전이 백년대계면 대한민국 형사사법 시스템을 고치는 문제는 천년대계""라며 이같이...",http://news.mt.co.kr/mtview.php?no=2022043016573898880
779,2022.08.29.,"국방장관, 합참 이전 비용 '김은혜 1200억 발표' 오류 시인",프레시안언론사 선정,"최영함 통신 두절에 여야 질타 쇄도…욱일기 게양한 관함식 ""이전에도 참석"" 국방부가 청와대 이전으로 인한 합동참모본부 이전 비용이 1200억 원가량이라는 대통령직 인수위의 발표가 사실을 축소했음을 시인했다. 29일...",https://www.pressian.com/pages/articles/2022082913395627440?utm_source=naver&utm_medium=search
780,2022.09.07.,"[사설]이상민 '산·학 지방이전', 또 선전용일까 주시한다",무등일보,"또 사회적 논란에도, 충분한 준비 없이도 시행착오에도 거칠게 밀어붙인 청와대 이전 사례서 볼 수 있듯이 현정부의 의지만 있으면 가능하리라는 점은 명확하다. 그러나 반도체 인력양성 수도권 몰아주기에 비춰보건데 이...",http://www.mdilbo.com/detail/nPE2fj/677816
781,2022.05.06.,탁현민 “차기정부 내내 ‘청와대 이전’ 어려움 겪을 것”,한겨레,탁현민 청와대 의전비서관이 차기 정부의 대통령 집무실 이전에 대해 “청와대 이전 문제가 내내 어려움을 겪을 것”이라고 말했다. 탁 비서관은 6일 &lt;시비에스&gt;(CBS) ‘김현정의 뉴스쇼’에 나와 “제가 얘기하는 건 의전과...,https://www.hani.co.kr/arti/politics/bluehouse/1041817.html
782,2022.04.28.,"고민정 ""尹, '청와대 이전'부터 국민투표 부쳐라""",매일경제언론사 선정,"고민정 더불어민주당 의원이 윤석열 대통령 당선인 측이 이른바 '검수완박'(검찰청법·형사소송법 개정안) 법안과 관련해 국민투표를 추진한다는 데 대해 ""'청와대이전'부터 국민투표에 붙여줄 것을 요구한다""고 말했다....",http://news.mk.co.kr/newsRead.php?no=376725&year=2022
783,2022.04.24.,청와대이전TF “윤석열 외교부 공관 방문한 적 없어”,대한경제,‘깜짝방문 지적’·‘김건희 언급’ 등도 부인…“명백한 허위사실” 윤석열 정부의 집무실 이전을 논의하고 있는 ‘청와대이전TF’는 24일 “윤 당선인은 관저 이전과 관련해 외교부장관 공관을 방문한 적이 없다”고...,https://www.dnews.co.kr/uhtml/view.jsp?idxno=202204241520014580007
784,2022.08.10.,[이슈밀착] '문화예술 단지' VS '경복궁 후원 보존'... 청와대 활용 뜨거운 감...,한국일보언론사 선정,박물관 전문가 사이에선 경복궁 경내에 있는 국립민속박물관이나 국립고궁박물관을 청와대 건물로 이전하자는 아이디어가 나온다. 청와대의 역사문화적 가치를 높이고 경복궁 복원사업의 효율도 높이는 일석이조 효과가...,https://hankookilbo.com/News/Read/A2022080718550001572?did=NA
785,2022.05.07.,"청와대이전TF, 탁현민·김어준 법적 책임 물을 터",프라임경제,"대통령직인수위원회(위원장 안철수, 이하 인수위) 청와대이전TF(이하 TF)가 탁현민 청와대 의전비서관과 유투버 방송인 김어준에 대한 법적 책임을 물을 것이라고 7일 밝혔다. 지난 2일 TF는 윤석열 대통령 당선인 배우자...",http://www.newsprime.co.kr/news/article.html?no=567061
786,2022.04.25.,"청와대이전TF ""윤석열 당선인, 취임식 이후 국방부 청사 5층에서 근무""",이투데이,"대통령직인수위원회 청와대 이전 태스크포스(TF)는 25일 ""윤석열 당선인은 내달 10일 취임식 후부터 국방부 청사 5층에서 근무하게 된다""고 밝혔다. 이후 본 집무실이 마련되는 2층으로 옮길 예정이다. 윤한홍 인수위...",https://www.etoday.co.kr/news/view/2127431
787,2022.09.05.,"용산이전 비용·경호 예산…강승규 ""확인해야"" 野 ""쟁점 파악 안돼""",뉴시스언론사 선정,"대통령실은 집무실을 청와대에서 용산으로 이전하는 데 기존에 알려진 비용에 더해 총 300억여 원이 추가로 투입된 데에 ""각 부처별로 자체 판단한 데 따른 부대비용""이라고 해명한 바 있다. 한 의원은 대통령실의 이같은...",http://www.newsis.com/view/?id=NISX20220905_0002002782&cID=10301&pID=10300
788,2022.04.12.,[인수위 기획영상] 대통령집무실 이전 의미 '100년 전 청와대에서 생긴 일' [...,천지일보,"해서 짧지 않았던 영욕의 정치사와 역사를 되새길 기획영상을 준비했다. 천지일보,인수위,인수위원회,20대대통령,청와대,역사,이승만대동령,윤석열대통령,청와대이전,대통령,대통령집무실이전",http://www.newscj.com/news/articleView.html?idxno=968725
789,2022.04.07.,용산 이전 늦더라도 청와대 사용 없다는 尹…김한길 “YS 하나회 척결급 용기...,더퍼블릭,"김한길, “尹 청와대 이전, YS 하나회 척결급 용기있는 결단” 김 위원장은 7일 연합뉴스와의 인터뷰에서 윤석열 대통령 당선인의 대통령 집무실 용산 이전과 관련해 “YS(김영삼 전 대통령)가 대통령이 되고 하나회를...",http://thepublic.kr/news/newsview.php?ncode=1065580858214647
790,2022.04.06.,"[인터뷰] 김종대 ""청와대 졸속 이전, 가장 큰 문제는 위기관리 공백""",시사저널언론사 선정,아울러 김 전 의원은 청와대 이전 구상이 당초 광화문에서 용산으로 변경된 데 대한 배경에 대해서도 의혹을 제기했다. 그는 윤 당선인의 고교 선배인 김용현 청와대 이전 태스크포스(TF) 부팀장이 한 기자의 의견을 들은...,http://www.sisajournal.com/news/articleView.html?idxno=236134
791,2022.04.06.,"장제원 ""청와대 조직, 이전보다 축소하는 방향으로 논의""",이투데이,"6일 ""청와대 조직을 이전보다 축소하는 방향으로 논의하고 있다""고 밝혔다. 장 실장은 이날 서울 통의동 인수위원회 프레스 라운지에서 '청와대 조직 개편 방향'에 대한 기자들의 질문에 이같이 답했다. 다만 구체적인...",https://www.etoday.co.kr/news/view/2121291
792,2022.04.06.,"청와대 용산 이전 본격화""...합참은 남태령 수방사로 이동",BBS NEWS,"용산 청와대 이전사업 중 국방부 지휘부서와 합동참모본부의 필수 안보시설을 우선 마련하기로 했습니다. 다만, 이사비 일괄계약이 필요하다는 점을 고려해, 국방부 이전비용 전체 118억원을 예비비에 반영했습니다....",https://news.bbsi.co.kr/news/articleView.html?idxno=3064121
793,2022.04.24.,"청와대이전TF ""尹당선인, 외교장관 공관 '깜짝방문'한 적 없다""",뉴시스언론사 선정,"인수위 청와대이전TF는 24일 출입기자들에 공지를 보내 ""윤석열 당선인은 관저 이전과 관련해 외교부장관 공관을 방문한 적이 없다""라고 밝혔다. 이어 보도 내용 중 '외교부장관 쪽과 사전 약속 없이 깜짝 방문해 당혹감을...",http://www.newsis.com/view/?id=NISX20220424_0001845567&cID=10301&pID=10300
794,2022.04.05.,"尹 '청와대 이전'과 겹친 북악산 개방…靑 ""文 약속 지킨것""",중앙일보언론사 선정,반면 윤 당선인은 청와대 이전 계획의 실현을 앞두고 있다. 당장 집무실을 용산 국방부로 이전하는데 필요한 비용이 6일 김부겸 국무총리가 주재하는 임시 국무회의에서 승인될 예정이다. ‘이사 비용’이 마련되면서...,https://www.joongang.co.kr/article/25061139
795,2023.04.11.,"[뉴스킹]김용남 ""美감청, 방미 때 지렛대로 활용"" vs 정봉주 ""의제 채택 후 항...",YTN,"그러니까 만약에 용산으로 대통령실 이전을 안 하고 청와대에 있었으면 안 뚫렸겠느냐, 아니면 그 전에는 뚫린 적이 없겠느냐. 그건 알 수 없죠. 사실은 청와대라고 보안이 완벽했느냐. 저는 그렇게는 생각 안 해요....",https://www.ytn.co.kr/_ln/0101_202304111243110099
796,2022.04.05.,인수위 '청와대 이전' 본격 착수...용산 집무실 명칭 공모,머니투데이,"인수위 홈페이지에 '청와대 이전과 개방' 메뉴 추가, 집무실 명칭 공모 이달 중 실시] 대통령직 인수위원회가 홈페이지 내에 '청와대 이전과 개방' 메뉴를 추가했다. 윤석열 당선인이 취임하는 5월 10일 즉시 청와대를 전면...",http://news.mt.co.kr/mtview.php?no=2022040514173098302
797,2022.04.04.,"질러놓고,용산 집무실 이전 일정 안갯속...""文 청와대가 알아서 해주실 일""",펜앤드마이크,"윤석열 대통령 당선인 측이 청와대 집무실 용산 이전 일정에 대해 ""무리하게 '이거 아니면 안된다'라는 외통수는 없다""는 입장을 밝혔다. 대통령직인수위원회는 ""청와대와 정부가 알아서 해주실 일""이라며 집무실 이전...",http://www.pennmike.com/news/articleView.html?idxno=52971
798,2022.04.04.,"尹당선인 측 ""집무실 이전 예비비, 청와대와 현 정부가 결정할 사안""",더팩트,"원일희 인수위 수석부대변인은 4일 오후 서울 종로구 통의동 인수위 공동기자회견장 브리핑에서 ""대통령 집무실 이전 총비용 496억 원은 청와대 이전 TF가 청와대와 현 정부에 처음부터 요청한 액수다. 이것이 어떤 액수로...",http://news.tf.co.kr/read/ptoday/1929024.htm
799,2022.04.04.,용산 대통령집무실 새이름 찾는다...'청와대 이전' 본격화,머니투데이,"청와대 이전 TF, 금주 중 관련 홈페이지 개설 예정] 대통령직인수위원회가 금주 중 윤석열 대통령 당선인이 근무하게 될 용산 집무실의 새이름을 정하기 위한 공모 절차에 착수한다. 오는 5월 10일 윤 당선인 취임일에 맞춰...",http://news.mt.co.kr/mtview.php?no=2022040415094262024
800,2022.04.05.,"인수위 청와대이전TF, 청와대 개방 위한 온라인 소통 나선다",파이낸셜뉴스,제20대 대통령직인수위원회 청와대이전 테스크포스(TF)는 인수위원회 홈페이지 내에 '청와대 이전과 개방' 메뉴를 추가하고 청와대 개방과 대통령실 이전에 관한 온라인 소통을 본격화한다고 5일 밝혔다. 특히...,http://www.fnnews.com/news/202204051401567624
801,2022.04.04.,"질러놓고,용산 집무실 이전 일정 안갯속...""文 청와대가 알아서 해주실 일""",펜앤드마이크,"윤석열 대통령 당선인 측이 청와대 집무실 용산 이전 일정에 대해 ""무리하게 '이거 아니면 안된다'라는 외통수는 없다""는 입장을 밝혔다. 대통령직인수위원회는 ""청와대와 정부가 알아서 해주실 일""이라며 집무실 이전...",http://www.pennmike.com/news/articleView.html?idxno=52971
802,2022.04.04.,"尹당선인 측 ""집무실 이전 예비비, 청와대와 현 정부가 결정할 사안""",더팩트,"원일희 인수위 수석부대변인은 4일 오후 서울 종로구 통의동 인수위 공동기자회견장 브리핑에서 ""대통령 집무실 이전 총비용 496억 원은 청와대 이전 TF가 청와대와 현 정부에 처음부터 요청한 액수다. 이것이 어떤 액수로...",http://news.tf.co.kr/read/ptoday/1929024.htm
803,2022.04.04.,용산 대통령집무실 새이름 찾는다...'청와대 이전' 본격화,머니투데이,"청와대 이전 TF, 금주 중 관련 홈페이지 개설 예정] 대통령직인수위원회가 금주 중 윤석열 대통령 당선인이 근무하게 될 용산 집무실의 새이름을 정하기 위한 공모 절차에 착수한다. 오는 5월 10일 윤 당선인 취임일에 맞춰...",http://news.mt.co.kr/mtview.php?no=2022040415094262024
804,2022.04.04.,"청와대 ""집무실 이전 예비비 상정, 현재로서는 계획 없다""",뉴스토마토,"박 수석은 청와대와 당선인 측이 대통령 집무실 이전을 위한 예비비 300억원 편성에 합의했다는 보도에 대해서는 ""확인이 안 된다""고 말을 아꼈다. 그는 ""정부 부처를 통해서 상정이 돼 봐야 알 수 있는 내용이지 실무협의...",http://www.newstomato.com/ReadNews.aspx?no=1115121&inflow=N
805,2022.04.04.,"대통령 집무실 이전 예비비, 청와대 '신중 또 신중'",내일신문,"청와대와 대통령직인수위원회측이 합참 이전을 제외한 대통령 집무실과 국방부 이전에 필요한 300억원 규모의 예비비를 지출하기로 합의했다는 보도에 대해서도 박 수석은 ""사실 여부를 확인할 수 없다""며 ""상황을...",http://www.naeil.com/news_view/?id_art=418885
806,2022.07.28.,이미 사진 있는데 또? 갈수록 황당해지는 문체부의 ‘청와대 구 본관 복원’ ...,세계일보언론사 선정,구 본관 터에 사진과 스토리텔링은 올해 청와대 개방 이전부터 존재했다. 사진은 인터넷 포털사이트에 ‘청와대 구 본관’을 검색하면 나오는 2018년 청와대 관람자의 후기 게시물. 네이버 캡처 이후 지난 20일 가진...,http://www.segye.com/content/html/2022/07/28/20220728525558.html?OutUrl=naver
807,2022.04.03.,청와대 이전 실무협의서 예비비 합의 중…용산시대 가시화,이데일리언론사 선정,"지난주 진행된 실무협의에는 윤 당선인 측 청와대 이전 태스크포스(TF)와 현 정부를 대표한 국방부, 행정안전부, 대통령 경호처 등 3개 기관 실무진이 참석한 것으로 알려졌다. 이철희 청와대 정무수석과 장제원 당선인...",http://www.edaily.co.kr/news/newspath.asp?newsid=01849926632292512
808,2022.09.02.,500억만 쓴다더니...계속해서 예산 추가되는 대통령실 이전비,인사이트,"당초 윤석열 대통령과 당시 청와대이전 TF팀장은 ""꼼꼼하게 계산해봤는데 500억 원 정도면 된다""고 장담했다.하지만 벌써 300억원 이상이 추가로 배정된 사실이 드러났다.대통령실 이전 관련 비용으로 국방부가...",https://www.insight.co.kr/news/410334
809,2022.04.26.,"이전 뒤 첫 개방되는 청와대, '인원제한' 관람예약 내일부터?...신청방법 및 ...",에너지경제,윤석열 대통령당선인의 ‘이전 공약’으로 개방되는 청와대가 오는 27일부터 관람 예약 신청을 받는다. 대통령직인수위원회는 26일 국민 접근성이 높은 온라인 플랫폼으로 국민 누구나 편리하게 관람 신청을 할 수...,https://www.ekn.kr/web/view.php?key=20220426010004575
810,2022.04.04.,"청와대 ""집무실 이전 예비비 상정, 현재로서는 계획 없다""",뉴스토마토,"박 수석은 청와대와 당선인 측이 대통령 집무실 이전을 위한 예비비 300억원 편성에 합의했다는 보도에 대해서는 ""확인이 안 된다""고 말을 아꼈다. 그는 ""정부 부처를 통해서 상정이 돼 봐야 알 수 있는 내용이지 실무협의...",http://www.newstomato.com/ReadNews.aspx?no=1115121&inflow=N
